<?xml version="1.0" encoding="UTF-8"?>
<!DOCTYPE animation SYSTEM "../animationDTD.dtd" >
<animation length="16.0" loop="true">
	
	<trackVec2f name="pos" interpolation="cubic">
		<keyframeVec2f time="0.0" x="-10.0" y="-5.0" />
		<keyframeVec2f time="5.0" x="5.0" y="-5.0" />
		<keyframeVec2f time="5.5" x="30.0" y="-5.0" />
		<keyframeVec2f time="6.5" x="5.0" y="-5.0" />
		<keyframeVec2f time="8.0" x="-10.0" y="-5.0" />
		<keyframeVec2f time="8.5" x="-40.0" y="-5.0" />
		<keyframeVec2f time="16.0" x="-10.0" y="-5.0" />
	</trackVec2f>

</animation>
